{
  "schema_version": 1,
  "environment_name": "example-public-api",
  "system_name": "JSONPlaceholder (public demo API)",
  "timezone": "UTC",
  "report_language": "en",
  "company_logo_path": "../company-logo.svg",
  "apis": {
    "identity_service": {
      "base_url": "https://jsonplaceholder.typicode.com",
      "timeout_seconds": 30,
      "default": true
    },
    "business_api": {
      "base_url": "https://jsonplaceholder.typicode.com",
      "timeout_seconds": 30,
      "headers": {
        "X-Api-Key": "fictional-business-api-key"
      }
    }
  },
  "connectors": {
    "fake_ledger": {
      "type": "fake",
      "values": {
        "order_confirmed": "confirmed"
      },
      "failures": {}
    },
    "db2_main": {
      "type": "db2",
      "connection_string": "DATABASE=fictional_db;HOSTNAME=fictional-db2-host;PORT=50000;PROTOCOL=TCPIP;",
      "username": "fictional_db2_user",
      "password": "fictional-db2-password"
    },
    "pg_main": {
      "type": "postgres",
      "connection_string": "postgresql://fictional-pg-host:5432/fictional_db?sslmode=prefer",
      "username": "fictional_pg_user",
      "password": "fictional-pg-password",
      "connect_timeout": 10
    },
    "kafka_main": {
      "type": "kafka",
      "brokers": ["fictional-kafka-broker1:9092", "fictional-kafka-broker2:9092"],
      "username": "fictional_kafka_user",
      "password": "fictional-kafka-password"
    }
  }
}
